<?xml version="1.0" encoding="iso-8859-1"?>
<deltaresTestbench_v3 xmlns="http://schemas.deltares.nl/deltaresTestbench_v3"
         xmlns:xsi="http://www.w3.org/2001/XMLSchema-instance"
         xsi:schemaLocation="http://schemas.deltares.nl/deltaresTestbench_v3 http://content.oss.deltares.nl/schemas/deltaresTestbench_v3-2.00.xsd">
    <config>
        <localPaths>
            <testCasesDir>./data/cases</testCasesDir>
            <enginesDir>./data/engines</enginesDir>
            <referenceDir>./data/reference_results</referenceDir>
        </localPaths>
        <locations>
            <location name="reference_results">
                <credential ref="commandline"/>
                <root>https://repos.deltares.nl/repos/DSCTestbench/trunk/references</root>
            </location>
            <location name="cases">
                <credential ref="commandline"/>
                <root>https://repos.deltares.nl/repos/DSCTestbench/trunk/cases</root>
            </location>
            <location name="reference_engines">
                <credential ref="commandline"/>
                <root>https://repos.deltares.nl/repos/DSCTestbench/trunk/references/bin</root>
            </location>
            <location name="engines_to_compare">
                <credential ref="commandline"/>
                <root>https://repos.deltares.nl/repos/DSCTestbench/trunk/references</root>
            </location>
            <location name="local">
                <root>./data/engines</root>
            </location>
        </locations>
    </config>
    <!--
    Programs
    -->
    <programs>
        <!--
        The order is important. Start with the following programs:
            command_prompt
            svn
            mpi
        -->
        <program name="command_prompt">
            <path>cmd</path>
            <arguments>
                <argument>/C</argument>
            </arguments>
        </program>
        <program name="svn">
            <path>thirdparty\svn\win64\svn.exe</path>
        </program>
        <program name="dimr" logOutputToFile="true" programStringRemoveQuotes="true" addSearchPaths="true">
            <shell ref="command_prompt"/>
            <location ref="reference_engines" type="reference">
                <from>win64</from>
            </location>
            <location ref="local" type="check">
                <from>teamcity_artifacts/x64</from> <!-- just the first part of the directory structure, wil be file by TeamCity -->
            </location>
            <path>dimr/bin/dimr.exe</path>
            <environments>
                <environment name="D3D_HOME" type="path">[programpath(dimr)]\..\..\..</environment>
                <environment name="ARCH" type="raw">win64</environment>
                <environment name="OMP_NUM_THREADS" type="raw">1</environment>
            </environments>
        </program>
    </programs>
    <!--
    default testCases
    -->
    <defaultTestCases>
        <testCase name="dimr_trunk">
            <programs>
                <program ref="dimr">
                    <arguments>
                        <argument>dimr.xml</argument>
                        <argument>&gt;dimr_screen.log 2&gt;&amp;1</argument>
                    </arguments>
                </program>
            </programs>
            <location ref="reference_results" type="reference">
                <from>win64</from>
            </location>
            <location ref="cases" type="input">
                <from>.</from>
            </location>
            <maxRunTime>60.0</maxRunTime> <!-- seconds -->
        </testCase>
    </defaultTestCases>
    <!--
    testCases
    -->
    <testCases>
        <!-- ======================================================================== -->
        <testCase name="e02_f091_c040_rws_waal" ref="dimr_trunk">
            <path>e02_dflowfm/f091_rws_acceptance/c040_rws_waal</path>
            <maxRunTime>7200.0</maxRunTime> <!-- seconds -->
             <checks>
                <file name="dflowfm/resultaten/Q10165_his.nc" type="NETCDF">
                    <parameters>
                        <parameter name="waterlevel" toleranceAbsolute="0.01" />
                    </parameters>
                </file>
            </checks>              
        </testCase>
        <!-- ======================================================================== -->
    </testCases>
</deltaresTestbench_v3>
