<?xml version="1.0" encoding="iso-8859-1"?>
<deltaresTestbench_v3 xmlns="http://schemas.deltares.nl/deltaresTestbench_v3" xmlns:xsi="http://www.w3.org/2001/XMLSchema-instance" xsi:schemaLocation="http://schemas.deltares.nl/deltaresTestbench_v3 http://content.oss.deltares.nl/schemas/deltaresTestbench_v3-2.00.xsd">
  <!--
				Basic Linux   configuration file: tb3_cfg_lnx64_hp.xml
				Basic Windows configuration file: tb3_cfg_win32_hp.xml
				From hp to sp      : Replace "config_d_hydro.xml" by "config_d_hydro_sp.xml" (all occurences)
				From hp to parallel: Use mpi as shell (in related program)
									 Overrule maxruntime when needed
									 Only cases that run in parallel mode
				-->
  <config>
    <!-- CRITICAL, ERROR, WARNING, INFO, DEBUG -->
    <localPaths>
      <testCasesDir>.\data\cases</testCasesDir>
      <enginesDir>.\data\engines</enginesDir>
      <referenceDir>.\data\references</referenceDir>
    </localPaths>
    <locations>
      <location name="dsctestbench-cases">
        <credential ref="commandline" />
        <root>https://repos.deltares.nl/repos/DSCTestbench/trunk/cases</root>
      </location>
      <location name="dsctestbench-references">
        <credential ref="commandline" />
        <root>https://repos.deltares.nl/repos/DSCTestbench/trunk/references</root>
      </location>
      <location name="local">
        <root>./data/engines</root>
      </location>
    </locations>
  </config>
  <!--
				Programs
				
				Optional attributes:
					ignoreStandardError="true"       default: false
					ignoreReturnValue="true"         default: false
					logOutputToFile="true"           default: true
					programStringRemoveQuotes="true" default: false
						Needed by WAQ1: -p "proc_def" does NOT work
										-p proc_def   does work
					shellStringRemoveQuotes="true"   default: false
						Needed by mpi: mpirun -n 3 "program program_args" does NOT work
									   mpirun -n 3 program programargs    does work
				
				Path:
					The path to the executable is build as follows:
						<networkpath_root>/<from>path
					To local:
						<networkpath>/<from>
						is copied to
						<localPaths_enginesDir>/<to>
						where "<to>" is by default the same value of "<from>"
						When "<version" is defined, "_<version>" is added.
					Example:
						if:
						<networpath_root>        = /f/h4/opt
						<from> = <to>            = swan/lnx64
						<path>                   = bin/swan.exe
						<llocalPaths_enginesDir> = /tmp
						then:
						copyRecursive /f/h4/opt/swan/lnx64 /tmp/swan/lnx64
						all subdirs of /tmp/swan/lnx64 are added to the searchPaths automatically
				
				Environment parameters:
					type path:
						"." resolves to <localPaths_enginesDir>/<to>                (in example above: /tmp/swan/lnx64)
						example:
						<environment name="D3D_HOME" type="path">..\.</environment> (in example above: /tmp/swan)
					type raw:
						just the value
						example:
						<environment name="ARCH" type="raw">lnx64</environment>
				-->
  <programs>
    <program name="command_prompt" addSearchPaths="false">
      <path>cmd</path>
      <arguments>
        <argument>/C</argument>
      </arguments>
    </program>
    <program name="svn" addSearchPaths="false">
      <path>thirdparty\svn\win64\svn.exe</path>
    </program>
    <program name="DFlowFM" logOutputToFile="true">
      <location ref="dsctestbench-references" type="reference">
        <from>bin/dflowfm/win64</from>
      </location>
      <location ref="local" type="check">
        <from>teamcity_artifacts/bin/dflowfm/win64</from>
      </location>
      <path>dflowfm.exe</path>
      <arguments>
        <argument>--autostartstop</argument>
      </arguments>
      <environments>
        <environment name="OMP_NUM_THREADS" type="raw">1</environment>
      </environments>
    </program>
  </programs>
  <defaultTestCases>
    <testCase name="dflowfm_default">
      <location ref="dsctestbench-cases" type="input">
        <!-- if "to" is not specified, "from" is used as target -->
        <from>.</from>
      </location>
      <location ref="dsctestbench-references" type="reference">
        <from>win64</from>
      </location>
      <maxRunTime>3600.0</maxRunTime>
      <!-- seconds -->
    </testCase>
  </defaultTestCases>
      <testCases>
	    <testCase name="e02_f019_c013_tracer_channel3D" ref="dflowfm_default">
		  <path>e02_dflowfm/f019_transport/c013_tracer_channel3D</path>
		  <programs>
			<program ref="DFlowFM">
			  <arguments>
				<argument>tracer3D.mdu</argument>
				<argument>--autostartstop</argument>
			  </arguments>
			</program>
		  </programs>
		  <maxRunTime>15000.0000000</maxRunTime>
		  <checks>
			<file name="dflowfmoutput/tfl_his.nc" type="netCDF">
			  <parameters>
				<parameter name="waterlevel" toleranceAbsolute="0.0001" />
				<parameter name="x_velocity" toleranceAbsolute="0.0001" />
				<parameter name="y_velocity" toleranceAbsolute="0.0001" />
				<parameter name="salinity" toleranceAbsolute="0.0001" />
			  </parameters>
			</file>
			<file name="depthgr.xyz" ignore="true" />
		  </checks>
		</testCase>
		<testCase name="e02_f021_c001_bedwithobstacle_anticreep" ref="dflowfm_default">
		  <path>e02_dflowfm/f021_anti-creep/c001_bedwithobstacle_anticreep</path>
		  <programs>
			<program ref="DFlowFM">
			  <arguments>
				<argument>sigma.mdu</argument>
				<argument>--autostartstop</argument>
			  </arguments>
			</program>
		  </programs>
		  <maxRunTime>15000.0000000</maxRunTime>
		  <checks>
			<file name="dflowfmoutput/sigma_his.nc" type="netCDF">
			  <parameters>
				<parameter name="waterlevel" toleranceAbsolute="0.0001" />
				<parameter name="x_velocity" toleranceAbsolute="0.0001" />
				<parameter name="y_velocity" toleranceAbsolute="0.0001" />
				<parameter name="salinity" toleranceAbsolute="0.0001" />
			  </parameters>
			</file>
		  </checks>
		</testCase>
		<testCase name="e02_f021_c002_slopingbed_anticreep" ref="dflowfm_default">
		  <path>e02_dflowfm/f021_anti-creep/c002_slopingbed_anticreep</path>
		  <programs>
			<program ref="DFlowFM">
			  <arguments>
				<argument>anticreep01.mdu</argument>
				<argument>--autostartstop</argument>
			  </arguments>
			</program>
		  </programs>
		  <maxRunTime>15000.0000000</maxRunTime>
		  <checks>
			<file name="dflowfmoutput/anticreep01_his.nc" type="netCDF">
			  <parameters>
				<parameter name="waterlevel" toleranceAbsolute="0.0001" />
				<parameter name="x_velocity" toleranceAbsolute="0.0001" />
				<parameter name="y_velocity" toleranceAbsolute="0.0001" />
				<parameter name="salinity" toleranceAbsolute="0.0001" />
			  </parameters>
			</file>
		  </checks>
		</testCase>
     </testCases>
</deltaresTestbench_v3>
