<?xml version="1.0" encoding="iso-8859-1"?>
<deltaresTestbench_v3 xmlns="http://schemas.deltares.nl/deltaresTestbench_v3"
         xmlns:xsi="http://www.w3.org/2001/XMLSchema-instance"
         xmlns:xi="http://www.w3.org/2001/XInclude"
         xsi:schemaLocation="http://schemas.deltares.nl/deltaresTestbench_v3 http://content.oss.deltares.nl/schemas/deltaresTestbench_v3-2.00.xsd">
    <config>
        <localPaths>
            <testCasesDir>./data/cases</testCasesDir>
            <enginesDir>./data/engines</enginesDir>
            <referenceDir>./data/reference_results</referenceDir>
        </localPaths>
        <locations>
            <location name="reference_results">
                <credential ref="commandline"/>
                <root>https://repos.deltares.nl/repos/DSCTestbench/trunk/references</root>
            </location>
            <location name="cases">
                <credential ref="commandline"/>
                <root>https://repos.deltares.nl/repos/DSCTestbench/trunk/cases</root>
            </location>
            <location name="reference_engines">
                <credential ref="commandline"/>
                <root>https://repos.deltares.nl/repos/DSCTestbench/trunk/references/bin</root>
            </location>
            <location name="engines_to_compare">
                <credential ref="commandline"/>
                <root>https://repos.deltares.nl/repos/DSCTestbench/trunk/references</root>
            </location>
            <location name="local">
                <root>./data/engines</root>
            </location>
        </locations>
    </config>
  <programs>
    <program name="command_prompt" addSearchPaths="false">
      <path>cmd</path>
      <arguments>
        <argument>/C</argument>
      </arguments>
    </program>
    <program name="svn" addSearchPaths="false">
      <path>thirdparty\svn\win64\svn.exe</path>
    </program>
    <program name="dimr" logOutputToFile="true" programStringRemoveQuotes="true" addSearchPaths="true">
        <path>dimr/bin/dimr.exe</path>
        <shell ref="command_prompt"/>
        <location ref="reference_engines" type="reference">
            <from>win64</from>
        </location>
        <location ref="engines_to_compare" type="check">
            <from>teamcity_artifacts/x64</from>
        </location>
    </program>
    <program name="checkhydbal" addSearchPaths="false">
      <path>thirdparty\checkhydbal\win64\checkhydbal.exe</path>
    </program>
	
    <program name="mormerge" logOutputToFile="true" ignoreStandardError="true" ignoreReturnValue="true" addSearchPaths="true">
	    <path>dmor/scripts/run_mormerge.bat</path>
        <location ref="reference_engines" type="reference">
            <from>win64</from>
        </location>
        <location ref="engines_to_compare" type="check">
            <from>teamcity_artifacts/x64</from>
        </location>
    </program>

  </programs>
  <defaultTestCases>
    <testCase name="dflowfm_default">
    <programs>
        <program ref="dimr">
            <arguments>
                <argument>dimr.xml</argument>
                <argument>&gt;dimr_screen.log 2&gt;&amp;1</argument>
            </arguments>
        </program>
    </programs>
      <location ref="cases" type="input">
        <!-- if "to" is not specified, "from" is used as target -->
        <from>.</from>
      </location>
      <location ref="reference_results" type="reference">
        <from>win64</from>
      </location>
      <maxRunTime>3600.0</maxRunTime>
      <!-- seconds -->
    </testCase>
    <testCase name="dflowfm_config">
    <programs>
        <program ref="dimr">
            <arguments>
                <argument>dimr_config.xml</argument>
                <argument>&gt;dimr_screen.log 2&gt;&amp;1</argument>
            </arguments>
        </program>
    </programs>
      <location ref="cases" type="input">
        <!-- if "to" is not specified, "from" is used as target -->
        <from>.</from>
      </location>
      <location ref="reference_results" type="reference">
        <from>win64</from>
      </location>
      <maxRunTime>3600.0</maxRunTime>
      <!-- seconds -->
    </testCase>
    <testCase name="platform_specific">
    <programs>
        <program ref="dimr">
            <arguments>
                <argument>dimr.xml</argument>
                <argument>&gt;dimr_screen.log 2&gt;&amp;1</argument>
            </arguments>
        </program>
    </programs>
      <location ref="cases" type="input">
        <!-- if "to" is not specified, "from" is used as target -->
        <from>.</from>
      </location>
      <location ref="reference_results" type="reference">
        <from>win64</from>
      </location>
      <maxRunTime>3600.0</maxRunTime>
      <!-- seconds -->
    </testCase>
  </defaultTestCases>
  <!--
  testCases
  -->

<testCases>
    <testCase name="e123_f01_c01_trench_VanRijn1993_mormerge_e02_f22_c01" ref="dflowfm_default">
        <path>e123_dflowfm-mormerge/f01_general/c01_trench_VanRijn1993_mormerge_e02_f22_c01</path>
        <maxRunTime>600.0000000</maxRunTime>
        <programs>
            <program ref="mormerge">
                <workingDirectory>merge</workingDirectory>
                <arguments>
                    <argument>trench_windows.mm</argument>
                </arguments>
            </program>
        </programs>
        <checks>
            <file name="strong/dflowfmoutput/test_his.nc" type="netCDF">
                <parameters>
                    <parameter name="waterlevel" toleranceAbsolute="0.1"/>
                    <parameter name="bedlevel"   toleranceAbsolute="0.1"/>
                </parameters>
            </file>
            <file name="weak/dflowfmoutput/test_his.nc" type="netCDF">
                <parameters>
                    <parameter name="waterlevel" toleranceAbsolute="0.1"/>
                    <parameter name="bedlevel"   toleranceAbsolute="0.1"/>
                </parameters>
            </file>
            <file name="strong/dflowfmoutput/test_map.nc" type="netCDF">
                <parameters>
                    <parameter name="mesh2d_s1"     toleranceAbsolute="0.1"/>
                    <parameter name="mesh2d_u1"     toleranceAbsolute="0.1"/>
					<parameter name="mesh2d_mor_bl" toleranceAbsolute="0.1"/>
                </parameters>
            </file>
            <file name="weak/dflowfmoutput/test_map.nc" type="netCDF">
                <parameters>
                    <parameter name="mesh2d_s1"     toleranceAbsolute="0.1"/>
                    <parameter name="mesh2d_u1"     toleranceAbsolute="0.1"/>
					<parameter name="mesh2d_mor_bl" toleranceAbsolute="0.1"/>
                </parameters>
            </file>
        </checks>
    </testCase>

    <testCase name="e123_f02_c01_trench_VanRijn1993_mormerge_e02_f22_c01" ref="dflowfm_default">
        <path>e123_dflowfm-mormerge/f02_mergedtuser/c01_trench_VanRijn1993_mormerge_e02_f22_c01</path>
        <maxRunTime>600.0000000</maxRunTime>
        <programs>
            <program ref="mormerge">
				<workingDirectory>merge</workingDirectory>
				<arguments>
					<argument>trench_windows.mm</argument>
				</arguments>
			</program>
		</programs>
		<checks>
			<file name="strong/dflowfmoutput/test_his.nc" type="netCDF">
				<parameters>
					<parameter name="waterlevel" toleranceAbsolute="0.1"/>
					<parameter name="bedlevel"   toleranceAbsolute="0.1"/>
				</parameters>
			</file>
			<file name="weak/dflowfmoutput/test_his.nc" type="netCDF">
				<parameters>
					<parameter name="waterlevel" toleranceAbsolute="0.1"/>
					<parameter name="bedlevel"   toleranceAbsolute="0.1"/>
				</parameters>
			</file>
			<file name="strong/dflowfmoutput/test_map.nc" type="netCDF">
				<parameters>
					<parameter name="mesh2d_s1"     toleranceAbsolute="0.1"/>
					<parameter name="mesh2d_u1"     toleranceAbsolute="0.1"/>
					<parameter name="mesh2d_mor_bl" toleranceAbsolute="0.1"/>
				</parameters>
			</file>
			<file name="weak/dflowfmoutput/test_map.nc" type="netCDF">
				<parameters>
					<parameter name="mesh2d_s1"     toleranceAbsolute="0.1"/>
					<parameter name="mesh2d_u1"     toleranceAbsolute="0.1"/>
					<parameter name="mesh2d_mor_bl" toleranceAbsolute="0.1"/>
				</parameters>
			</file>
		</checks>
	</testCase>

</testCases>
</deltaresTestbench_v3>
