<?xml version="1.0" encoding="iso-8859-1"?>
<deltaresTestbench_v3 xmlns="http://schemas.deltares.nl/deltaresTestbench_v3"
		xmlns:xsi="http://www.w3.org/2001/XMLSchema-instance"
		xmlns:xi="http://www.w3.org/2001/XInclude"
		xsi:schemaLocation="http://schemas.deltares.nl/deltaresTestbench_v3 http://content.oss.deltares.nl/schemas/deltaresTestbench_v3-2.00.xsd">
				<!--
				Basic Linux   configuration file: tb3_cfg_lnx64.xml
				Basic Windows configuration file: tb3_cfg_win64.xml
				-->
	<config>
		<localPaths>
			<testCasesDir>./data/cases</testCasesDir>
			<enginesDir>./data/engines</enginesDir>
			<referenceDir>./data/references</referenceDir>
		</localPaths>
		<locations>
			<location name="p-opt-engines">
				<credential ref="commandline"/>
				<root>/f/h4/opt</root>
			</location>
			<location name="testbench_v1-engines">
				<credential ref="commandline"/>
				<root>./data/engines</root>
			</location>
			<location name="dsctestbench-cases">
				<credential ref="commandline"/>
				<root>https://repos.deltares.nl/repos/DSCTestbench/trunk/cases</root>
			</location>
			<location name="dsctestbench-references">
				<credential ref="commandline"/>
				<root>https://repos.deltares.nl/repos/DSCTestbench/trunk/references</root>
			</location>
			<location name="network-references">
				<root>./data/engines</root>
			</location>
			<location name="local">
				<root>./data/engines</root>
			</location>
		</locations>
	</config>
				<!--
				Programs
				
				Optional attributes:
					ignoreStandardError="true"       default: false
					ignoreReturnValue="true"         default: false
					logOutputToFile="true"           default: true
					programStringRemoveQuotes="true" default: false
						Needed by WAQ1: -p "proc_def" does NOT work
										-p proc_def   does work
					shellStringRemoveQuotes="true"   default: false
						Needed by mpi: mpirun -n 3 "program program_args" does NOT work
									   mpirun -n 3 program programargs    does work
					storeOutput="true"               default: false
						Needed by esm_create: The result must be passed through to setenv(DIO_SHM_ESM)/esm_delete
						Before using this attribute, ALL program-output was stored. This caused problems on Linux.
				
				Path:
					The path to the executable is build as follows:
						<networkpath_root>/<from>path
					To local:
						<networkpath>/<from>
						is copied to
						<localPaths_enginesDir>/<to>
						where "<to>" is by default the same value of "<from>"
						When "<version" is defined, "_<version>" is added.
					Example:
						if:
						<networpath_root>        = /f/h4/opt
						<from> = <to>            = swan/lnx64
						<path>                   = bin/swan.exe
						<llocalPaths_enginesDir> = /tmp
						then:
						copyRecursive /f/h4/opt/swan/lnx64 /tmp/swan/lnx64
						all subdirs of /tmp/swan/lnx64 are added to the searchPaths automatically
				
				Environment parameters:
					type path:
						"." resolves to <localPaths_enginesDir>/<to>                (in example above: /tmp/swan/lnx64)
						example:
						<environment name="D3D_HOME" type="path">../.</environment> (in example above: /tmp/swan)
					type raw:
						just the value
						example:
						<environment name="ARCH" type="raw">lnx64</environment>
				-->
	<programs>
		<!--
		The order is important. Start with the following programs:
			command_prompt
			svn
			mpi
		-->
		<program name="command_prompt">
			<path>/bin/bash</path>
			<arguments>
				<argument>-c</argument>
			</arguments>
		</program>
		<program name="svn">
			<path>svn</path>
			<environments>
				<environment name="LD_LIBRARY_PATH" type="path">/opt/subversion/lib</environment>
			</environments>
		</program>
		<!---
		<program name="mpi" shellStringRemoveQuotes="true" addSearchPaths="true" excludeSearchPathsContaining="share/delft3d/esmf">
			<path>mpiexec</path>
			<arguments>
 				<argument>-n 2</argument>
			</arguments>
			<modules>
				<module>intel/18.0.3</module>
				<module>mpich/3.3.2_intel18.0.3</module>
			</modules>
		</program>
		-->
		<program name="vs" ignoreStandardError="true" ignoreReturnValue="true" addSearchPaths="true" excludeSearchPathsContaining="share/delft3d/esmf">
			<shell ref="command_prompt"/>
			<path>thirdparty/vs/lnx64/vs</path>
			<environments>
				<environment name="PAGER" type="raw">more</environment>
			</environments>
		</program>

		<program name="PART" logOutputToFile="true" addSearchPaths="true" excludeSearchPathsContaining="share/delft3d/esmf">
			<location ref="dsctestbench-references" type="reference">
				<from>bin/delft3d_open_source/lnx64</from>
			</location>
			<location ref="local" type="check">
				<from>teamcity_artifacts/lnx64</from>
			</location>
			<path>bin/run_dpart.sh</path>
		</program>
	</programs>
				<!--
				default testCases
				
				Testcases may refer to a default testCase with the attribute
				ref="name_of_default_testcase"
				-->
	<defaultTestCases>
		<testCase name="part_default">
			<location ref="dsctestbench-cases" type="input">
				<!-- if "to" is not specified, "from" is used as target -->
				<from>.</from>
			</location>
			<location ref="dsctestbench-references" type="reference">
				<from>lnx64</from>
			</location>
			<maxRunTime>3600.0</maxRunTime> <!-- seconds -->
		</testCase>
	</defaultTestCases>
				<!--
				testCases
				
				Optional attributes:
					maxRunTime: OverruleRefMaxRunTime="true" default: false
									if false: maxRunTime in this config.xml file is     overruled by the maxRunTime of the reference run
									if true : maxRunTime in this config.xml file is NOT overruled by the maxRunTime of the reference run
				
				Special replacements:
				[output(progname)]		: Will be replaced by the output of (the last run of) program "progname"
										  Used by esm_create (Linux)
				[programpath(progname)] : Will be replaced by the path to the program named "progname"
										  Used by WAQ1 to refer to the proc_def file
				
				Checks:
					<file name="dat-file" type="NEFIS">
						<parameters name="groupname">
							<parameter name="quantity" toleranceAbsolute="real_value">
					<file name="nc-file" type="netCDF">
						<parameters>                                        (name not needed)
							<parameter name="quantity" toleranceAbsolute="real_value">
					<file name="filnam" type="ASCII"/>      (parameters/parameter not needed)
					Optional attribute:
						ignore="true" Don't bother when this file is in the reference dir but absent in the check dir
				
				-->
	<!--
	testCases
	-->
	<xi:include href="../include/dpart_all_cases.xml"/>
</deltaresTestbench_v3>
