<?xml version="1.0" encoding="iso-8859-1"?>
<deltaresTestbench_v3 xmlns="http://schemas.deltares.nl/deltaresTestbench_v3" xmlns:xsi="http://www.w3.org/2001/XMLSchema-instance" xsi:schemaLocation="http://schemas.deltares.nl/deltaresTestbench_v3 http://content.oss.deltares.nl/schemas/deltaresTestbench_v3-2.00.xsd">
    <!--
    Basic Configuration file
    -->
    <config>
        <localPaths>
            <testCasesDir>./data/cases</testCasesDir>
            <enginesDir>./data/engines</enginesDir>
            <referenceDir>./data/reference_results</referenceDir>
        </localPaths>
        <locations>
            <location name="reference_engines">
                <credential ref="commandline"/>
                <root>https://repos.deltares.nl/repos/DSCTestbench/trunk/references</root>
            </location>
            <location name="reference_results">
                <credential ref="commandline"/>
                <root>https://repos.deltares.nl/repos/DSCTestbench/trunk/cases</root>
            </location>
            <location name="cases">
                <credential ref="commandline"/>
                <root>https://repos.deltares.nl/repos/DSCTestbench/trunk/cases/</root>
            </location>
            <location name="engines_to_compare">
                <root>./data/engines</root>
            </location>
        </locations>
    </config>
    <!--
    Programs
    -->
    <programs>
        <!--
        The order is important. Start with the following programs:
            command_prompt
            svn
            mpi
        -->
        <program name="command_prompt">
            <path>cmd</path>
            <arguments>
                <argument>/C</argument>
            </arguments>
        </program>
        <program name="PYTHON">
            <shell ref="command_prompt"/>
            <path>python.exe</path>
        </program>
        <program name="svn">
            <path>thirdparty/svn/win64/svn.exe</path>
        </program>
        <program name="dimr" logOutputToFile="true" programStringRemoveQuotes="true">
            <path>dimr/scripts/run_dimr.bat</path>
            <shell ref="command_prompt"/>
            <location ref="reference_engines" type="reference">
                <from>x64</from>
            </location>
            <location ref="engines_to_compare" type="check">
                <from>teamcity_artifacts/x64</from>
            </location>
        </program>
    </programs>
    <!--
    default testCases
    -->
    <defaultTestCases>
        <testCase name="skillbed_default">
            <programs>
                <program ref="dimr"/>
            </programs>
            <location ref="reference_results" type="reference">
                <from>.</from>
            </location>
            <location ref="cases" type="input">
                <from>.</from>
            </location>
            <maxRunTime>60.0</maxRunTime> <!-- seconds -->
        </testCase>
    </defaultTestCases>
    <!--
    testCases
    -->
    <testCases>
        <!-- ======================================================================== -->
        <testCase name="e200_f01_c02_egmond" ref="skillbed_default" ignore="true">
            <path>e200_skillbed/f01_flowfm_wave/c02_egmond</path>
            <programs>
                <program ref="dimr" seq="1" >
                    <arguments>
                        <argument>dimr_config.xml &gt;dimr.log 2&gt;&amp;1</argument>
                    </arguments>
                </program>                
                <program ref="PYTHON" seq="2" >
                    <arguments>
                        <argument>postprocessing/scripts/post_processing.py &gt;post_processing.log 2&gt;&amp;1</argument>
                    </arguments>
                </program>                
                <program ref="PYTHON" seq="3" >
                    <arguments>
                        <argument>scripts/generate_latex_doc/generate_latex_doc.py --texfile doc/casedoc.tex &gt;casedoc.log 2&gt;&amp;1</argument>
                    </arguments>
                </program>                
            </programs>
            <maxRunTime>14400.0</maxRunTime> <!-- seconds -->
        </testCase>
        <!-- ======================================================================== -->
        <testCase name="e200_f02_c01_straight_coast_breakwater" ref="skillbed_default" ignore="true">
            <path>e200_skillbed/f02_flowfm_wave_mor_vs_d3d4/c01_straight_coast_breakwater</path>
            <programs>
                <program ref="dimr" seq="1" >
                    <arguments>
                        <argument>dimr_config.xml &gt;dimr.log 2&gt;&amp;1</argument>
                    </arguments>
                </program>                
                <program ref="PYTHON" seq="2">
                    <arguments>
                        <argument>postprocessing/scripts/post_processing.py &gt;post_processing.log 2&gt;&amp;1</argument>
                    </arguments>
                </program>                
                <program ref="PYTHON" seq="3">
                    <arguments>
                        <argument>scripts/generate_latex_doc/generate_latex_doc.py --texfile doc/casedoc.tex &gt;casedoc.log 2&gt;&amp;1</argument>
                    </arguments>
                </program>                
            </programs>
            <maxRunTime>14400.0</maxRunTime> <!-- seconds -->
        </testCase>
        <!-- ======================================================================== -->
        <testCase name="e200_f02_c02_zandmotor_first_year" ref="skillbed_default" ignore="true">
            <path>e200_skillbed/f02_flowfm_wave_mor_vs_d3d4/c02_zandmotor_first_year</path>
            <programs>
                <program ref="dimr" seq="1" >
                    <arguments>
                        <argument>dimr_config.xml &gt;dimr.log 2&gt;&amp;1</argument>
                    </arguments>
                </program>                
                <program ref="PYTHON" seq="2">
                    <arguments>
                        <argument>postprocessing/scripts/post_processing.py &gt;post_processing.log 2&gt;&amp;1</argument>
                    </arguments>
                </program>                
                <program ref="PYTHON" seq="3">
                    <arguments>
                        <argument>scripts/generate_latex_doc/generate_latex_doc.py --texfile doc/casedoc.tex &gt;casedoc.log 2&gt;&amp;1</argument>
                    </arguments>
                </program>                
            </programs>
            <maxRunTime>14400.0</maxRunTime> <!-- seconds -->
        </testCase>
        <!-- ======================================================================== -->
        <testCase name="e200_f02_c06_avalanching" ref="skillbed_default" ignore="false">
            <path>e200_skillbed/f02_flowfm_wave_mor_vs_d3d4/c06_avalanching</path>
            <programs>
                <program ref="dimr" seq="1" >
                    <arguments>
                        <argument>dimr_config.xml &gt;dimr.log 2&gt;&amp;1</argument>
                    </arguments>
                </program>                
                <program ref="PYTHON" seq="2">
                    <arguments>
                        <argument>postprocessing/scripts/post_processing.py &gt;post_processing.log 2&gt;&amp;1</argument>
                    </arguments>
                </program>                
                <program ref="PYTHON" seq="3">
                    <arguments>
                        <argument>scripts/generate_latex_doc/generate_latex_doc.py --texfile doc/casedoc.tex &gt;casedoc.log 2&gt;&amp;1</argument>
                    </arguments>
                </program>                
            </programs>
            <maxRunTime>14400.0</maxRunTime> <!-- seconds -->
        </testCase>
    </testCases>
</deltaresTestbench_v3>
