<?xml version="1.0" encoding="iso-8859-1"?>
<deltaresTestbench_v3 xmlns="http://schemas.deltares.nl/deltaresTestbench_v3"
         xmlns:xsi="http://www.w3.org/2001/XMLSchema-instance"
         xmlns:xi="http://www.w3.org/2001/XInclude"
         xsi:schemaLocation="http://schemas.deltares.nl/deltaresTestbench_v3 http://content.oss.deltares.nl/schemas/deltaresTestbench_v3-2.00.xsd">
    <config>
        <localPaths>
            <testCasesDir>./data/cases</testCasesDir>
            <enginesDir>./data/engines</enginesDir>
            <referenceDir>./data/reference_results</referenceDir>
        </localPaths>
        <locations>
            <location name="reference_results">
                <credential ref="commandline"/>
                <root>https://repos.deltares.nl/repos/DSCTestbench/trunk/references</root>
            </location>
            <location name="reference_engines">
                <credential ref="commandline"/>
                <root>https://repos.deltares.nl/repos/DSCTestbench/trunk/references/bin</root>
            </location>
            <location name="cases">
                <credential ref="commandline"/>
                <root>https://repos.deltares.nl/repos/DSCTestbench/trunk/cases</root>
            </location>
            <location name="engines_to_compare">
                <credential ref="commandline"/>
                <root>./data/engines</root>
            </location>
        </locations>
    </config>
    <programs>
         <program name="command_prompt">
            <path>/bin/bash</path>
            <arguments>
                <argument>-c</argument>
            </arguments>
        </program>
        <program name="svn">
           <path>svn</path>
            <environments>
                <environment name="LD_LIBRARY_PATH" type="path">/opt/subversion/lib</environment>
            </environments>
        </program>
        <program name="dimr" logOutputToFile="true" programStringRemoveQuotes="true">
            <path>bin/run_dimr.sh</path>
            <location ref="reference_engines" type="reference">
                <from>lnx64</from>
            </location>
            <location ref="engines_to_compare" type="check">
                <from>teamcity_artifacts/lnx64</from> <!-- just the first part of the directory structure, wil be file by TeamCity -->
            </location>
        </program>
    </programs>
    <!--
    default testCases
    -->
    <defaultTestCases>
        <testCase name="dimr_trunk">
            <programs>
                <program ref="dimr">
                    <arguments>
                        <argument>-m dimr.xml</argument>
                    </arguments>
                </program>
            </programs>
            <location ref="reference_results" type="reference">
                <from>lnx64</from>
            </location>
            <location ref="cases" type="input">
                <from>.</from>
            </location>
            <maxRunTime>600.0</maxRunTime> <!-- seconds -->
        </testCase>
    </defaultTestCases>
  <!--
  testCases
  -->
  <xi:include href="../include/dimr_dflowfm_drtc_tutorials.xml"/>
</deltaresTestbench_v3>